,RNC,Repetitive,Desc.,Phase,Ref,ECD
1,Q321013865-1,Yes,Low clearance. Tube and Bulkhead,3,PCR 61582,N/A
2,Q321013894-1,Yes,Bonding test too high,3,RFC,27-Aug
3,Q321013725-5,Yes,Double hole Drag Angle LH Upp,4,COS G05450606-101-05,70128
4,Q321013725-6,No,One-Off,N/A,N/A,N/A
5,Q321013727-3,Yes,Double hole Drag Angle LH Upp,4,COS G05450606-101-05,70128
6,Q321013884-1,No,One-Off,N/A,N/A,N/A
7,Q321013867-1,Yes,Excessive Fiber glass tape under clamp.,3,N/A,N/A
8,Q321013867-2,Yes,Excessive Fiber glass tape under clamp.,3,N/A,N/A
